"","vtitle","vpoint","vreview"
"986","미나리","10","이런 모험영화, 각본 너무 좋음 인디아나존스 같은 모험영화 좋음"
"987","극장판 귀멸의 칼날: 무한열차편","10","나랑 주인공은 전혀 다르지만 왜 내가 계속 대입되는지 모르겠음..."
"988","세자매","8","암톳듀잇암톳듀잇암톳듀잇암톳듀잇암톳듀잇암톳듀잇암톳듀잇암톳듀잇암톳듀잇암톳듀잇암톳듀잇암톳듀잇암톳듀잇암톳듀잇암톳듀잇암톳듀잇암톳듀잇암톳듀잇암톳듀잇암톳듀잇암톳듀잇암톳듀잇암톳듀잇암톳듀잇암톳듀잇암톳듀잇암톳듀잇암톳듀잇암톳듀잇암톳듀잇암톳듀잇암톳듀잇암톳듀잇암톳듀잇암톳듀잇암톳듀잇암톳듀잇암톳듀잇암톳듀잇암톳듀잇암톳듀잇암톳듀잇암톳듀잇암톳듀잇암톳듀잇암톳듀잇암톳듀잇암톳듀잇암톳듀잇암톳듀잇암톳듀잇암톳듀잇암톳듀잇암톳듀잇암톳듀잇암톳듀잇암톳듀잇암톳듀잇암톳듀잇암톳듀잇암톳듀잇암톳듀잇암톳듀잇암톳듀잇암톳듀잇암톳듀잇암톳듀잇암톳듀잇암톳듀잇암톳듀잇암톳듀잇암톳듀잇"
"989","그랜드파더","7","나름 신선한 코메디 영화 ㅋㅋㅋ"
"990","미나리","8","이야기가 지루하지 않고 넘 힐링되는 영화였어요 가볍게 보기 좋아요."
"991","미나리","10",""
"992","미나리","10","27년만에 다시봐요. ㅠㅠ 엄지척"
"993","미나리","10","네명의 친구들 연기가 넘 좋았어요 진짜 친구들인줄..어떤일이있어도 이런 찐친들만있으면 힘이나죠!!"
"994","극장판 귀멸의 칼날: 무한열차편","8","시리즈물의 초석이라면 그렇다 하면서 볼 정도의 영화. 그게 아니라면 비추."
"995","PMC: 더 벙커","10","마지막 재회에서 눈물이 ㅠㅠ"
"996","미나리","10",""
"997","극장판 귀멸의 칼날: 무한열차편","8","슈퍼맨, 위대하고 웅장한 시작"
"998","세자매","10","잼써요 ㅠㅠ 한번더 보고싶네여 .."
"999","그랜드파더","10","렌고쿠는 지지않았다.."
"1000","미나리","10","진짜 최고 네번 봤는데 네번 다 가슴이 웅장해짐 ㄹㅇ 최고"
"1001","미나리","10","도경수 1도 관심없었는데 다시 보게 됨"
"1002","미나리","4","이게뭐냐. . 배우 다데려다놓고"
"1003","미나리","1","3편보고 스텔론 형님이 머 이런 쓰레기 영화에...? 라고 어이가 없었고...2편은 다르겠지 믿으며 봤지만 30분간 참고 보다가 꺼버림2편을 이따구로 찍었었는데 스텔론 형님은 3편까지 찍은건가... 돈이 급하셨나"
"1004","극장판 귀멸의 칼날: 무한열차편","9","취향에 따라 호불호 갈리는건 알겠는데 이건 이정도 평점받을 영화는 아니라고 생각하는데.. 영상미, 전개는 덤이고 아름다운 영화였다"
"1005","PMC: 더 벙커","8",""
"1006","미나리","10","솔직히 줄거리고 나발이고 다 필요없고 스타워즈을 능디하는 전투씬을 우리의 자본과 기술력으로만으로 실현된 것에 한없는 자부심을 느낀다!"
"1007","극장판 귀멸의 칼날: 무한열차편","2","웃음포인트 못찾음...."
"1008","세자매","1","스토리, 연출 등등 모든게 기준 미달... 스텔론 형님만 믿고 봤는데 정말 더럽게 재미없음"
"1009","그랜드파더","10","꼭 보세요 두번 보세요 ㅠㅠ 전투씬 최고"
"1010","미나리","9","빈약한 스토리이지만 가볍게 볼만했다. 재밌었다. cg에 어색함이 없다."
"1011","미나리","10",""
"1012","미나리","10","원작을 생각 안하고 그냥 객관적으로 본다면?"
"1013","미나리","10","하아 썸남이랑 보지마셈마스카라 다 번져서 미친판다년됐다"
"1014","극장판 귀멸의 칼날: 무한열차편","8","보고나서 감정이 넘 복잡하고 풍성했어요메마른 삼성에 막 빗질을 한듯 결결이 다 아프고 부모세대의 생활 그런거 이상인생의 씁쓸 따뜻한 살가움이 계속 되살아나고 있네요"
"1015","PMC: 더 벙커","10","뭔가먹먹해지면서 슬프면서도 기분이 이상해지는 영화였어요 배우님들 연기가 날 울렸다ㅜ"
"1016","미나리","4","똥을 싸다 말고 나온 느낌.이게 뭐야?제대로 된 설명도 없이 그냥 막 넘어가..떡밥 회수는 해야할것 아녀.."
"1017","극장판 귀멸의 칼날: 무한열차편","10","너무 재밌게 잘봤습니다"
"1018","세자매","1","어일선 주보비 지화섭 오재무 모아 놓으니까 이름 개 웃기네 ㅋㅋㅋ"
"1019","그랜드파더","10","동현배우 연기도 잘하고 내용도 지루하지않고 재미있게보고왔네요~"
"1020","미나리","10","진짜 너무 재밌다 ㅜㅜㅜ급 인생영화 되려고 하네.. 공룡을 좋아하기도 하고 벌레나오는 장면도 너무 잘 만들어져서 소리지르면서 봄"
"1021","미나리","4","회장 창고 다털림ㅋㅋㅋ"
"1022","미나리","10","내용은 그럭저럭인데 동현배우가 연기도잘하고 잘생긴듯 동현배우보는 재미로 봤네요"
"1023","미나리","4","영상미와 음악은 좋으나 기억에 남을만한 영화적 스토리는 부족함"
"1024","극장판 귀멸의 칼날: 무한열차편","6","온워드보다 별로예요."
"1025","PMC: 더 벙커","10","재밌게 봤습니다 동현배우가 연기를 정말 잘하네요"
"1026","미나리","7","독립영화. 미쿡영화오프닝, 엔딩 음악 좋음.연기가 명품.브렛 핏 제작사라 홍보효과~~외국어 영화가 아니라미국영화로 노미네이트 됐어도작품상은 힘들겠어.기생충은 전세계가 고민하는빈부격차에 대한 갈등을멋지게 은유했지만,미나리는  고단한 이민자 이야기"
"1027","극장판 귀멸의 칼날: 무한열차편","8","구원은 어디에 있는가"
"1028","세자매","10","디즈니가 손댔으면 호빗족은 흑인이 되고 간달프는 흑인남자, 레골라스는 흑인여자, 아르웬은 중국인이 됐을걸... 생각만해도 끔_찍. 절대 디즈니가 자기 작품에 손 못대게 한 톨킨옹의 예지력 ㄷㄷ해...   ""나는 월트 디즈니의 재능은 인정하지만, 나에게는 언제나 절망적으로 타락한 것처럼 보였다. 그의 스튜디오에서 진행되는 대부분의 '작품'에는 감탄하거나 매력적인 구절들이 있지만, 그것들 모두가 나에게 미치는 영향은 역겹다. 몇몇은 나를 구역질 나게 했다."" - J. R. R. Tolkien 1964.07.15."
"1029","그랜드파더","10","어닐적 나를볼거 같아...연신 눈물 콧물 흘려나왔던 영화."
"1030","미나리","10","찌릿찌릿한 영화임 일단 귀칼 보던사람이면 알고임 그 짜릿함을 ㅠㅠㅠ 일단 혼자 집중해서 볼 맛이남 ㅠㅠ 진짜 개재미있었음^^ 영화를 원래 재밌게 보는편이라서 딱히 나빴던 점은 없던것 같움 ㅋㅋㅋㅋ"
"1031","미나리","10","전지현 얼굴 보느라 2시간 반 다 보낸듯,,"
"1032","미나리","10","송중기라는 배우가 ‘아빠 연기’를 할 수 있을까? 라고 잠시나마 생각했던 제가 한심할 정도로 부성애가 느껴져서 많이 감동했고 울었습니다.. 어떻게하면 그런 감정 연기가 가능한 것인지 .... 감독님의 연출도 너무 좋았습니다."
"1033","미나리","4","강동원 볼수록 조민수+심슨 .."
"1034","극장판 귀멸의 칼날: 무한열차편","10","졸잼임 스토리구성 영상 다 좋음"
"1035","PMC: 더 벙커","10","기대를 져버리지않는 디즈니!! 21년 한해를 감종적인 영화와 함께"
"1036","미나리","5","배우들은 편안한 연기를 펼치고, 노년의 사랑과 삶에 대해 그럭저럭 괜찮은 내용을 전달한다."
"1037","극장판 귀멸의 칼날: 무한열차편","7","좀 지루했어요  프랑스 영화 좋아 하시는 분들한테 추천합니다  모든  배우들의  연기는  아주 칭찬합니다"
"1038","세자매","10","역시나 명불허전 실버스타스텔론의 명연기엄지척입니다."
"1039","그랜드파더","4","캐릭터는 평범하고 살인 장면은 인상적이지 않으며 배경과 설정을 최대한으로 살리지 못한다."
"1040","미나리","10","스토리도 탄탄하고 액션도 진짜 멋졌고 마지막엔 감동..ㅠㅠ"
"1041","미나리","10","눈빛에 미치고 영상미에 치이고 OST에 치이고 스토리에 감탄하게 하는 영화ㅠㅅㅠ"
"1042","미나리","10","나 눈물 진짜없는 사람인데 줄줄 울었음 하"
"1043","미나리","10","말해 뭐해 디즈니 최고!"
"1044","극장판 귀멸의 칼날: 무한열차편","10","감독의 생각이 잔잔하게 잘 전달되었어요~~~충분히 가치있는 영화."
"1045","PMC: 더 벙커","1","일본 영화 리메이크=폭망 공식 못깸"
"1046","미나리","2","이게 왜 상을 받은건지 모르겠다. 2배속으로 보고 싶어질 정도로 한장면 한장면이 늘어지는게... 지루하다는 느낌"
"1047","극장판 귀멸의 칼날: 무한열차편","10","해마다 한번은 봐줘야하는 영화"
"1048","세자매","10","청춘에게 힘을 줌 갠차늠"
"1049","그랜드파더","10","기생충과는 정반대의 이야기에요. 먹먹한 가슴의 울림이 있으며 신기하게도 영화 다 보고나서 시간이 흐르면 느낀답니다. 막상 영화보는중에 영화관람끝날때는 실감이 안남 그 이후에 감동을 느끼는 먹먹함을 느껴요."
"1050","미나리","4","코로나 때문에 봤지만 늘어지는 스토리가 끝까지 보기 힘드네요"
"1051","미나리","1","남자가 여자가 되보기 전까진, 남자들은 여자가 어떻게 죽어나가건 그것에 집중하는것에도 아무관심도 없다. 그저 귀찮기 때문이다. 언제나 파리목숨으로 산다는것엔 파리만이 집중할 뿐이니까....지기럴."
"1052","미나리","10","인사이드아웃도 재밌게 봤던 저로써.. 소울.. 진짜 제 인생영화입니다. 두번이나 영화관에서 봤습니다. 제가 같은영화를 두번 영화관에서 본건 이 영화가 처음입니다. 내가 잘 살고 있나 가 고민이신 분께 정말 정말 정말 좋은 영화라고 생각합니다. 픽사 영화는 항상 응원합니다."
"1053","미나리","8","블박단 차가 한대도 없는게 노이해"
"1054","극장판 귀멸의 칼날: 무한열차편","9","가족이란 이런 것,,,"
"1055","PMC: 더 벙커","7","이건 몬헌 유저들에게 헌정하는 영화 같네, 워크래프트 무비는 게임 안했던 사람도 이해하기 쉬웠는데,이 영화는 게임을 어느정도 해봤어야 반가운 얼굴들이 있고 게임에서 이벤트 미션을 플레이했다면개연성이 얼추 들어 맞는데, 게임 안해본사람이 이영화를 봤다? 내용 뒤죽박죽에 뭐가 뭔지 제대로 이해하기도 어렵고 불친절하게도 그런 과정은 싹 빼놓아서 영.. 그리고 몬헌월드 브금을 레퍼런스좀 하던가OST가 88년대 인줄알았네.. 무슨 말하는 자동차 나오고 그랬어야 하는 줄"
"1056","미나리","1","이야 명배우들 모아서 아주 요상한걸찍었네"
"1057","극장판 귀멸의 칼날: 무한열차편","8","나치전범하이드리히, 일본전범 이토히로부미의 만행이 똑같군!  저격사건도 같고.전범국가는 끔찍히 싫고역겹다!"
"1058","세자매","9","DC만의 딥다크함을 진심으로 잘 표현한 영화, 몰락해 가는 DC 멱살 잡아서 끌어올린 영화"
"1059","그랜드파더","8","저의 평가 기준은 제 아들의 만족도 입니다.성인들이 보기엔 어릴때보던 톰과제리를 굳이.. 할수도 있습니다. 하지만 저희 아들은 충분히 만족스러워 했습니다"
"1060","미나리","10","5점 만점에 5점짜리 영화임ㅋㅋㅋ 기대보다 더 재밌게 본 영화"
"1061","미나리","1","장르에 액션은 지워야할듯. 너무 늙어버린 리암니슨. 액션장면 기대하지 마세요."
"1062","미나리","10",""
"1063","미나리","7","마지막에 렌고쿠 전투씬만 볼만하고 나머지는 지루했음"
"1064","극장판 귀멸의 칼날: 무한열차편","10","봐야지봐야지 생각하다가 언제까지 상영하나 보려고 들어갔는데 저희지역에선 그 날 기준으로 다음날까지만 상영하더라구여.. 그래서 바로 담날꺼로 예약하고 보라갔는데 너무너무 재밌고 연기도 배우 두분 다 너무 잘하셔서 정말 만족스러웠어요. 감동도 있고 무엇보다 배우분들 얼굴이 대유잼,,"
"1065","PMC: 더 벙커","3","뻔하고 재미없는 개그에 뻔한 전개.. 성공한 B급 영화들 따라하려는 P급 영화같네요..  김영광 좋아서 3점이라도 드립니다"
"1066","미나리","8","본편보다 앞에 달린 단편이 더 임팩트 있음."
"1067","극장판 귀멸의 칼날: 무한열차편","10","잔잔하게 흘러가듯 현질주의적 시각에서 바라볼수 있는 작품~~"
"1068","세자매","6","애들 아빠는 도대체 뭐하고, 애들 엄마랑 결혼도 안 한 여친 둘이서만 직장까지 소홀히 해가면서 애들 돌본다고 티격태격. 게다가 아무리 전남편 여친이 미워도 그렇지. 애들 먹으라고 싸준 도시락을 애들 보는 앞에서 쓰레기통에 버리는 친엄마 인성. 첫 장면부터 보기 힘들었음."
"1069","그랜드파더","1","사방이 펑펑터지고 긴박한상황에서 중국인이라고 총을안쏘질안나 아프리카라를 하나의 나라로 만들어버리는 무식하고 또라이같은장면 쓸때없이 학살하는장면과 중국은 UN상임이사국이라며 총안쏘는 미친생각을하는 감독"
"1070","미나리","10",""
"1071","미나리","9","이미 언론을 통해 많이 노출되어서인지알고 있는 영화를 보는 느낌이 감상을 방해하긴 했지만, 그럼에도 영화 전반적인 느낌과 배우들 연기에 몰두하며 따뜻하고 뭉클했다. 특히 배우들의 섬세한 연기에 몰입하게 된다."
"1072","미나리","7","톰홀랜드는 매번 민폐+띨구 캐릭터만 하는 것 같다.."
"1073","미나리","6","이해하면서 보는영화는 아닌걸 알고있는데나에게는 크게 와닿는게 없었다5년 후에 다시 관람할것"
"1074","극장판 귀멸의 칼날: 무한열차편","5","켈트의 영웅, 스코틀랜드의 군벌과 같은 역사적 추정이나 로망스 기사도 문학이라는 두 이야기 모두를 차치하더라도 등장인물들이 아서, 기네비어, 랜슬롯일 이유가 없다. 배우들 각각의 멋을 보는 재미만 있을 뿐."
"1075","PMC: 더 벙커","8","흔한 사랑 이야기인줄 알았는데 독특해서 재밌었다 영상미가 특히 너무 좋았음 라파엘이랑 펠릭스 왤케 웃겨ㅋㅋㅋ여자가 다시 남자와 사랑에 빠진게 인상적이고 결말도 나름 해피엔딩인것 같아서 좋았다"
"1076","미나리","10","보고 나왔는데도 계속 생각나게되고 메세지가 새겨지네요"
"1077","극장판 귀멸의 칼날: 무한열차편","2","이걸보고 감동받기엔 내가 너무 세상에 찌든듯"
"1078","세자매","10","처음부터 끝까지 영상미와 라야의 액션과 스토리에 압도되고 몰입된 영화ㅠㅠㅠ"
"1079","그랜드파더","7","음악이 매우 좋았다. 희망과 불안을 품은 현실... 영화 '벌새'의 후속 작품 처럼 보였다. 그 다음 후속 작품들의 한 갈래는 이미 세상에 나온지 오래... 그리고 한쪽 갈래는 아직도 나오지 않았다. 쳇바퀴 돌듯 시대별 반복만 있을 뿐."
"1080","미나리","10","진짜 이런 스토리 ㅠㅠ 많이 나왔으면 ㅠㅠ 디즈니가 또 열일했네!!"
"1081","미나리","8","난 볼만했는데? 웃기고 ㅋㅋㅋ 근데 극장에서 내만 웃긴하더라 ㅋㅋ 안웃김? 난 토드 혼자 아임토드휴잇 할때 넘 웃겼는데 ㅋㅋ"
"1082","미나리","7","영상미는 좋음연기는 인정결말 허무 뜬금없이 끝남스토리 솔직히 별로임 20분잤음내가 너무 기대했나봄"
"1083","미나리","10","진짜 내인생애니..."
"1084","극장판 귀멸의 칼날: 무한열차편","9","어린시절의 추억이 생각나네요 이티 언제봐도 재밌어요"
"1085","PMC: 더 벙커","7","잔잔한 영화인데 손수건 세 번쯤 꺼내게 합니다.후반부로 가면서 힘이 달리는지 개연성없이 흘러갑니다.  보다 말고 전기 나가서 일어나 나온 느낌이랄까요? 아카데미상까지 바라는 건 상~ 욕심이라고 보입니다. 윤여정님의 연기는 기대가 컸던 탓인지  편안하긴 해도 울림이 작았습니다."
"1086","미나리","10","""숨을 내쉬어라."" 마지막 장면이 이 영화의 메시지인 것 같습니다."
"1087","극장판 귀멸의 칼날: 무한열차편","10","배우이광수씨 연인 배우이선빈배우님 영화오케이마담도잘봣습니다 코로나19조심하시구요 런닝맨이광수씨도응원하겠습니다ㅎㅎ"
"1088","세자매","10","언제나 믿고 관람하는 갓디즈니..ㅠㅠ"
"1089","그랜드파더","10","믿고 보는 디즈니라고 할만큼 이번에도 너무 재밌었습니다! 친구랑 봤는데 둘 다 재밌다구ㅠㅠㅠ 진짜 배경이 장난 아니더라구요"
"1090","미나리","4","낚인 기분임.왠지 다들 동조 하지 않으면감수성 없는 사람 되는거 같아서 동조한거 같음.사회적 약자를 조명하는 영화가 모두 명작은 아니란걸 알게해준 영화"
"1091","미나리","10","나이 처먹고 속도 없이 광광 울었지 뭐"
"1092","미나리","10","디즈니 애니는 ㅠㅠ 나에게 늘 힐링"
"1093","미나리","8","윤선생님과 앨랜의 연기가 일품이네요"
"1094","극장판 귀멸의 칼날: 무한열차편","1","전형적인 그 성별 물타기 영화 지금 연일 터지는 아동 살해 아동 학대 사건들 전부 그 성별인데 귀신같이 침묵하죠 사람죽여도 남자탓 하죠"
"1095","PMC: 더 벙커","10","어느 곳이든지 뿌리 내리고 잘 자라는 미나리와 같은 우리들의 삶을 그린 영화. 사실적이어서 아프기도하지만 또 사실적이어서 따뜻하다. 코로나로 삶이 많이 변화 한 오늘도 우리 모두 적응하고 살아가는 것처럼, 그럼에도 삶은 계속된다. 찬란하게."
"1096","미나리","8","잔잔. 귀여운 데이빗아"
"1097","극장판 귀멸의 칼날: 무한열차편","1","스토리 자체가 사이코패스.. 넷플릭스로 1.5배속으로 봐도 보기 힘듬.."
"1098","세자매","10","솔직히 스토리는 예상되지만, 사람의 믿음과 신뢰를 이렇게 아름답게 그려낼 수 있는건 디즈니밖에 없다. 엔딩크레딧에 영어 노래 듣고 나오세요."
"1099","그랜드파더","1","1기는 굿! 극장판은 돈주고 보는 건 내 양심상  안될거 같아서 보러가지 않습니다.이거 보러 갈분도  잘 생각하고 가시길 바랍니다. 토왜가 될수도 있고 친일파로찍힐수도 있습니다. 강요는 하지 않겠습니다. 보러갈분은 보러가세요. 참고로 귀걸이 문양이 욱일기인건 아시죠? 울나라에서만 수정된것 뿐입니다. 한편으론 살떨리고 무섭네요.  누군 햇살무늬 태양이라는데 그저 어처구니 없는 변명이죠 굳이 햇살무늬로 할 필요있나요? 지금 처럼 동그랗게만 하면 되지."
"1100","미나리","8","데이빗과 순자의 케미가 좋았다.부부갈등도 현실적었다"
"1101","미나리","10","너무 재밌고 감동적인 영화. 보고 나면 왜 여태 안 보았을까 하고 느끼게 되는 영화. 무조건 강추입니다."
"1102","미나리","10","서로의 믿음이 젤 중요한거 같아요 진짜 디즈니 작품들은 메세지가 최고인거 같습니다"
"1103","미나리","10","경적 함부로 울리는 인간은  죽여도 됨"
"1104","극장판 귀멸의 칼날: 무한열차편","6","영화계에 시상식에서 pc가 가득하다더니만 진짜인가?"
"1105","PMC: 더 벙커","8","잘만든 B급인데 A급 연기자들로 포장한 영화넷플릭스에 있어서 봤는데 그냥 주말에 가족들과 봐도 웃으며 즐기는게 가능한 딱 전형적인 한국형 경찰코믹 단 욕이 좀 나오니 어린아이들과는 비추"
"1106","미나리","8",""
"1107","극장판 귀멸의 칼날: 무한열차편","10",""
"1108","세자매","10","너무 재밌었어요 ㅎㅎ 기대 이상이였고 캐릭터들이 졸귀라 덕질할  요소 뿜뿜 !!!  또 보고 싶네요"
"1109","그랜드파더","10","귀멸의 칼날울 보시는분들은 꼭!! 봐야됩니다 제가 본 영화중에서 저는 최고였습니다!!정말로 강추드립니다."
"1110","미나리","8",""
"1111","미나리","10","영화상 받았다길래 궁금해서 보고 왔습니다 흥미롭게 잘 보고 왔습니다 독립영화 흥해라!!"
"1112","미나리","4","별로 생각나는게 없어..,"
"1113","미나리","10","간만에 감동 이빠이 받고 옴 힐링되는 시간이였음"
"1114","극장판 귀멸의 칼날: 무한열차편","8","이 한마디로 정리 끝난다.""내 코끼리 내놔!"""
"1115","PMC: 더 벙커","8","워킹데드 이후로 재미난 영화찾음 ..잠시도 심심할 틈이 없음"
"1116","미나리","10","제 인생영화...아 진짜 김희애 연기 너무 좋아요"
"1117","극장판 귀멸의 칼날: 무한열차편","10","낯선 땅에서 가진 희망 그 속의 가족 간의 갈등과 사랑"
"1118","세자매","8","프랑수아 오종의 연출력이 빛나다."
"1119","그랜드파더","10","미나리의 가족이 나에게 살아갈 힘을 주었다"
"1120","미나리","10","나만 당할 수 없지 휴 ㅋ"
"1121","미나리","8","우리 어렸을 때를 보여주는 것 같았어요. 삶이 알 수 없구나 싶으면서도 여운이 남아요."
"1122","미나리","10","라야와 마지막 드래근 꿀잼이였습니다ㅋㅋㅋ재밌구 역시 디즈니bb"
"1123","미나리","10","과거를 따뜻하게 바라보는 감독님의 시선이 좋았습니다."
"1124","극장판 귀멸의 칼날: 무한열차편","1","짱깨 아기의 연기가 현실이라서 매우 공감했다. 현실에서 짱깨는 통수의 민족이니까"
"1125","PMC: 더 벙커","10",""
"1126","미나리","6","먼지바람과 쓸쓸한 음악이 잘 섞여있다..형제를 위한 나라는 없다라는 한줄평이 딱 맞는 영화..^&^"
"1127","극장판 귀멸의 칼날: 무한열차편","8","자기만의 이야기가강력한 이유"
"1128","세자매","7","단점을 보안하는 장점들 마지막으로 보상다"
"1129","그랜드파더","10","보편적이고 아름답고 슬펐어요 너무너무 좋았어요특히 데이빗 정말 귀엽네요"
"1130","미나리","10",""
"1131","미나리","7","반듯한 이미지의 이정길 주인공인 드라마"
"1132","미나리","7","전작이랑 구성이 비슷한 것 같다... 자기가 원하는 의미는 담았다해도 모르고 보는 사람들에게는 전달력이 약한 것 같고, 스토리 역시 깔끔한 마무리는 아니었다고 생각함"
"1133","미나리","2","큰 틀의 스토리는 많은 사람들이 공감할만한 이야기이며 현실을 잘 반영하고 있다. -가부장제 안에서 여성들이 겪는 폭력과 이로 인해 또다른 가해자가 된다는 이야기- 그런데 보기 힘들고 유난히 폭력적으로 느껴지는 것은 연출의 문제라고 생각된다. 인물들과 장면장면이 모두 과장되어있다. 피해자에 대한 배려와 이해가 부족하고 폭력을 전시하는 것처럼 느껴져서 결과적으로 보기 불편한 영화가 되어버린 것 같다."
"1134","극장판 귀멸의 칼날: 무한열차편","1","테이큰감독도 어쩔수없나보네 페미 PC.. 진짜 재미없다 악당이 마지막에 경찰은 죽이면서 여주는 안쏘고 간다고? 완전억지"
"1135","PMC: 더 벙커","9","감동적이고 보고 삶의 의미에 대해 느낀게 많았습니다."
"1136","미나리","10",""
"1137","극장판 귀멸의 칼날: 무한열차편","6","진지하게 이게 재밌는건디 모르겠다....그냥 진짜 너무 유치했음....할말하않"
"1138","세자매","10","간만에 좋은 영화 만났네요.아동학대가 이슈가 되는 요즘, 많은 것을 생각하게 해주네요."
"1139","그랜드파더","8","미국 디즈니에서 만들었지만 다보고 나니 중국동북공정이 들어가네요 .대만 홍콩 몽골 한국  중국 믿음으로 이루자는 겹치는 애기 이것만 빼고 보면 완전 재미는 있네요스토리는 감동"
"1140","미나리","10","슬픈장면 없어도 울게되는 영화"
"1141","미나리","10","영화에 나오는 모든 배우들의 명품 연기와 너무 따뜻하면서도 슬픈 정말 감동적인 영화였습니다."
"1142","미나리","10","역시는 역시다"
"1143","미나리","10","재밌었어요 킬링타임으로 딱인듯"
"1144","극장판 귀멸의 칼날: 무한열차편","8","부모님들이 즐겨 보시던 드라마 옆에서 같이 시청하던 그시절 생각이나네"
"1145","PMC: 더 벙커","10","몰임갑있게 잘봤습니다~~추천드려요!!^^"
"1146","미나리","7","어릴때 이런 가족족인 분위기 드라마가 좋았다"
"1147","극장판 귀멸의 칼날: 무한열차편","8","자꾸 엄마가 생각나요.. 결혼.. 부부에대한 그리고 아이들보고난후 생각이 점점커지는 영화네요.."
