"","vtitle","vpoint","vreview"
"502","미나리","10","보는 내내 다른 생각 안하게 해주는 기분좋은 영화였어요 감동과 의미를 전달하는 영화도 좋지만 이렇게 코믹하게 웃게해주는 영화도 너무 좋네요"
"503","미나리","1","수준낮은 짱kkae 국뽕영화"
"504","극장판 귀멸의 칼날: 무한열차편","1","발연기에 발음도 제대로 안되는 사람들을 데려다 그것도  배우라고..사실 감상포인트 없음..."
"505","PMC: 더 벙커","10",""
"506","미나리","10","대빵 재밌음~♥ 짱짱짱"
"507","극장판 귀멸의 칼날: 무한열차편","10","이 모든걸 조경아작가의 자기자신 얘기를 다른이야기와 만든 작품이라면"
"508","세자매","8","거의 한장소에서 찍은영화인데지루하지않게 잘풀었다이서진은 너무 쓰레기로 나오네 ㅋㅋ"
"509","그랜드파더","7","딸과 함께 봤는데 아이들이 이해할 수 있는 수준은 아니어서다소 아쉬웠으나삶에 대한 물음표를 던지게 하는철학적인 문제를 재미있게 풀어낸 영화.어른에게 위로를 주는 영화."
"510","미나리","10","공감되는것이 많았어요"
"511","미나리","10","이건 진짜 끝까지봐야함 반전이있는 영화"
"512","미나리","10","렌고쿠사마ㅠㅠ 별기대없이 봤는데 감동ㅠㅠ"
"513","미나리","6","음.... 방해포인트1. ost..  쓸데없이 거창하고 쓸데없이 쓸쓸해서 몰입도 떨어지게 만듦 개연성 없이 막 집어넣은 ost  2. 이진욱 연기력.. 뭔가 다른 배우분들과 섞이지가 않네요..원래 이런식의 영화는 스토리상 어디 하나라도 구멍이 생기기 마련.. 연기력 몰입도로 보는건데 그나마 몰입도는 떨어지려다 잡아주는 구간이 있었는데 위 두가지가 좀 망쳤네요갠적으론 1번이 더 망..."
"514","극장판 귀멸의 칼날: 무한열차편","8","코미디 아님, 네이버는 영화좀 보고 장르 선정해줄래?"
"515","PMC: 더 벙커","9","하도 욕 하길래 안 보다가 이제야 봤는데좋은 영화네요 재밌게 잘 받습니다"
"516","미나리","10","아...진짜 띵작 ㅠㅠㅠ 렌고쿠 사랑해.."
"517","극장판 귀멸의 칼날: 무한열차편","10","덴젤워싱턴의 알코올중독 연기가 끝내준다. 개인적으로 로버트 저메키스 감독의 다른 영화들보다 훨씬 더 좋았다."
"518","세자매","10","배경 ,영상미, 음악 , 배우들 연기 다 미쳤다 오랫만에 첫사랑 감정 느끼게 해 준 너무 아름다운 영화 , 인생영화 한편 저장"
"519","그랜드파더","10","강아지는 사람보다 사람마음을 더 잘 아는...절대로 배신하지 않는 친구 입니다. 너무 재밌고 사랑스런 영화에요"
"520","미나리","7","여주는 이뻤다"
"521","미나리","1","감상포인트 없음은 왜 없는거죠? 너무 유치하고 재미없었습니다."
"522","미나리","10","진짜 이영화가 현실이 될까봐 무섭다ㅠ"
"523","미나리","10","행복을 제외한 모든 감정들을 소름끼치게 느낄수 있었다."
"524","극장판 귀멸의 칼날: 무한열차편","8","씬스틸러 최병장 ㅋㅋ 정극 연기도 진짜 잘하네요"
"525","PMC: 더 벙커","7","그래서 호랑이보다 무서운 겨울손님은 뭐였을까. 글을 쓰는것을 그만둔 후 찾아갔던 햄버거가게 알바도 경쟁률이 셌고, 대리기사일을 하며 거쳐갔던 손님들도 결코 녹록치 않았다. 호랑이보다 무서웠던 것은 냉혹한 현실이었다. 여자친구의 집을 떠나 친구의 집에 머물 때도, 그 집을 떠나 유정의 집에 들어갔을 때도 차가운 현실을 마주했다. 어느날 밤엔 호랑이를 피해 도망쳤지만 그곳에서 또 다른 누군가의 현실을 보게되었다. 그리고 그녀를 구한 후에야 호랑이에게 쫓겼던 사실을 기억해낸다. 이제 그는 호랑이를 마주한다. 힘겨운 현실속에 호랑이 쯤은 너무나 사소하다. 펜과 노트를 사서 한 글자 한 글자 적어내려간다."
"526","미나리","10","논스톱 감성 구리구리느낌나고 간만에 겁나웃었습니다 ㅋㅋㅋ"
"527","극장판 귀멸의 칼날: 무한열차편","10","크리스마스영화중에 가장 크리스마스를 잘 표현한 영화"
"528","세자매","10","후회만 남는 인생에서 저의 잘못이나 이루지 못했던 것들에 대해 다시한번 되돌아보게 되는 영화였습니다"
"529","그랜드파더","10","연인끼리는보지말길 ㅠ"
"530","미나리","10","잼나다 재미있는데 ㅋㅋ"
"531","미나리","10",""
"532","미나리","2","빻빻이가 너무 이쁘게 나왔다 디아블로스 빼곤 현실고증 0%"
"533","미나리","8","가슴 뜨거운 사랑의 진심. 그의 사랑은 평생 가슴에 사무칠 사랑이었다. 동정이나 연민이라고 비판받기엔, 너무나도 고결했던 그들의 사랑. 비록 현실에 부딪혔다고는 하지만 그게 뭔 대수랴.  진짜 현실은 너무나도 가볍고 가벼운 마음들이 만나 가짜 형상들을 이루고, 걸핏하면 부숴지기 일수인데.조제에게는 세상을 깨고 나올 수 있는 용기이자 희망이, 영주에게는 죽도록 사무칠 진심이 담긴 사랑이 되어주었다. 세월의 고통을 뛰어넘고, 작은 세계를 깨뜨린.아프지만 고요하고, 잔잔했으며 고결했던 그들의 사랑. 잔잔한, 생각이 깊어지는 고요의 영화."
"534","극장판 귀멸의 칼날: 무한열차편","10",""
"535","PMC: 더 벙커","10",""
"536","미나리","10","기대이상 상상이상, 언제나 앞으로가 중요한 거 아닌가"
"537","극장판 귀멸의 칼날: 무한열차편","8","캐릭터 하나하나가 살아있다 어느 하나 허투루 뭍히지 않는다 특히 김선영배우님 연기 ?♀?"
"538","세자매","6",""
"539","그랜드파더","10","감사하다는 말밖에는 떠오르지가 않네요..잊지 않겠습니다.존경합니다."
"540","미나리","10",""
"541","미나리","5","평점 졸라 높네 ㅋㅋㅋㅋ"
"542","미나리","10","어쩌다 보게 됐는데.. 넘 웃겨요~~"
"543","미나리","10","감독이 만들어낸 주옥같은 대사들이 나를 뭉클하게만든다"
"544","극장판 귀멸의 칼날: 무한열차편","9","와 긴장감이랑 몰입감 최고감히 '라이언일병구하기'와 더불어내가 본 최고의 전쟁영화"
"545","PMC: 더 벙커","10","막판에 폭풍 즙 짜냈다...죽어서까지도 딸 사랑ㅠㅠ아빠엄마 몫까지 잘 살아야 돼, 로지ㅠㅠ"
"546","미나리","10","한국 영화중 최고다"
"547","극장판 귀멸의 칼날: 무한열차편","5","이병헌이 백X산에 출연하는거나...매즈 미켈슨이 이 영화에 출연하는거나...도찐개찐(웃음)"
"548","세자매","10","우리 이영화 안본걸로합니다."
"549","그랜드파더","10","재밌따 꽃님이 너무 기엽다"
"550","미나리","6","음... 걍 개연성읎구, 죙일 집에만 있다가, 잠깐 다른 집갔다가 옥상올라가고 끝나서,,,싱겁고,,, 시간도 짧긴 한디, 걍 시간때올때 볼만해유~~ 진짜 좀비 연기자들이랑, 유아인이 연기덕에 봤다"
"551","미나리","9","방라잔2결전의날 짱"
"552","미나리","1","시나리오 개판에 배우들 연기 개판에 심지어 매력도없어서 몰입력을 저하시킴 ; 이딴영화 상준 영화제는 뭔생각인지"
"553","미나리","7","산소야 고마워 산소야 고마워"
"554","극장판 귀멸의 칼날: 무한열차편","9","뭔가 부족한게 한두개 있는 느낌이지만 괜춘괜춘"
"555","PMC: 더 벙커","2","게임의 실사화는 사실 사일런트힐 이외에는 별 기대하지않는다는 점을 감안하고 감상해도 이건 좀 이상타 리오레우스 다아블로스 네르스큐라 고어마가라는 놀라울정도로 CG나 모션디테일, 포효까지 게임과 비슷하게 구현해서 몰입감이 생길뻔하다가도 생태계 구현포기, 스토리 전개 포기, 세계관 구현 포기 등등 정작 중요한 부분이 너덜너덜하다.또 OST는 누가 만든건지 정말....이런거 왠만하면 안남기는데 이거는 참....각 몬스터 CG 구경 빼곤 아무리 쥐어짜도 칭찬거리가 없는 영화."
"556","미나리","10","실은 얘네 별로 안친한듯 합니다"
"557","극장판 귀멸의 칼날: 무한열차편","9","많은 생각을 하게 해주는 영화입니다몹시 불편하면서도 동시에 북받쳐 눈물이 나네요"
"558","세자매","10","가정교육의 중요성 매우 중요합니다"
"559","그랜드파더","10","30년된 영환데 지금 봐도 너무 재밌음 ㅋㅋㅋㅋ 애니 넘 무섭"
"560","미나리","2","일본은 배우 대부분 연기가 부자연스러움. 그래서 안 봤음."
"561","미나리","8","방심하다 깼다"
"562","미나리","10","소피아 로렌 영화 찾아보다 . 뜨악 이영화 보다 사랑이 너무 슬퍼서 울었네요 꼭보세요"
"563","미나리","10","어휴.. 진짜 대한민국 대변영화인줄 ㅠㅠ 모든 장면이 다 현실이고 울컥한다옛날에 자식들에게 하는 표현 방식들은 왤케 폭력적이였으까요 ㅠ지금 부모님들이 보면 마음에 위로를 받으시지 않으까 하는 영화 인거 같아요 주연조연할꺼없이 연기라고 안 믿길 만큼 표정부터 대사하나까지 너무 좋았던 영화!!2020년 올해를 이 영화로 시작하는 느낌입니다"
"564","극장판 귀멸의 칼날: 무한열차편","8","cg만으로도 큰점수를 먹고 들어가는영화 엔진 스따뜨는 보너스"
"565","PMC: 더 벙커","10","왜 이제야 봤나 싶어요너무 공감가고 가슴아팠습니다"
"566","미나리","10","97년도 첫직장을 다녔었는데...그때보다 지금이 더 힘들다...코로나 빨리 사라졌으면"
"567","극장판 귀멸의 칼날: 무한열차편","10","한국인이라면 너무 화나고 울컥한 마음이 듷게되는?? 영화인 것 같다."
"568","세자매","10","영화를 지금에서야 봤네요 묵직한 울림과 감동에 아직까지 관련 영상과 후기들 이틀내내 찾아 보고 있어요 책이든 영화든 두번 이상 보질 않는데 1987은 다시 보고 싶어요"
"569","그랜드파더","10",""
"570","미나리","5","끝에가서 무너지네..."
"571","미나리","6","마동석님 효과로 봤어요. 마표 강펀치로 그나마 속을 뚫었네요. 곽병두님 연기는 더 보고싶었는데.. 까메오였나요? 2006년 영화 '구타유발자들' 생각났어요."
"572","미나리","10","보기 힘들었지만 꼭 존재해야하는 영화라고 생각합니다."
"573","미나리","9","사랑의 대상에 따라 변하는 세상의 중심"
"574","극장판 귀멸의 칼날: 무한열차편","8","서클 최고경영자 둘을 엿먹이는 영화. 서클 안의 사람들은 모두 호호하하 즐겁기만하다. 하지만 주인공은 그렇지가 못하다. 잠재력은 높지만 할 줄 아는 것은 아무것도 없는 신입사원 백명 중의 한명일뿐. 서클러가 되기 위해 고군분투하지만 무엇인가 상황은 꼬여만간다. 그리고 결국 서클러가 되는데... 구글과 유튜브를 모티브로 한 것 같지만 사회비판적이라기 보단 기술로 인한 디스토피아적인 상황을 그려내고 있다. 그래서 회사이름이 서클이고 유튜브는 트루유가 된 거 같다. 그렇다고 서클이 무슨 일을 하는 회사인지는 정확히 모르겠고 트루유도 정확히는 유튜브가 아니다. 하지만 그와 상당히 닮았다. 사슴 킬러!! ㅎㅎ 왠지는 모르겠지만 디어헌터를 이 영화를 본 사람들에게 추천해주고 싶다."
"575","PMC: 더 벙커","10","엄마랑 같이 봤씁니다 평점이 너무 안좋아서 볼려다가 안보려했는데 그냥 봤는데 너무 재밌게봤어요 저희는;;진심으로;;; 감동적이고 메세지도 좋고 갈 가돗 너무 이쁘고 액션도 좋고 연기도 좋고 전 다 좋았어요;;"
"576","미나리","6","이건...원작을 본 내 잘못을 탓할께...원작을 안봐야 좋은 영화"
"577","극장판 귀멸의 칼날: 무한열차편","6","기묘하게 잘 어울리는 빌 머레이와 OST."
"578","세자매","7","비급호러나 병맛을 좋아하는 취향이라 나름 재미나게 봤음 ㅎㅎㅎ호불호가 있겠지만,  한국에 드문 장르라 개취로는 굿"
"579","그랜드파더","10","인생 영화중  한편이지요.  정말  살인적인  연기력과  빨려드는  스토리와 슬픔."
"580","미나리","10","개봉당시엔 말도안되서 저평가 받고 지금은 현실이 될거같으니 고평가받는듯"
"581","미나리","10","그냥 이런 영화 보면 눈물이 좔좔 흐른다다른 로맨스들과 클리셰는 비슷할 지언정 이런 잔잔한 감성은 확실히 다른 듯"
"582","미나리","10","넷플로 봤는데 3년간 본 영화 중 최고입니다.총과 전쟁이 주 스토리라 여자분들은 재미가 반감될수 있으나 남자분들은 강추 드립니다.북한이나 미국이나 뭐 정치적인 거는 다 떠나서....영상이 너무 좋습니다."
"583","미나리","10","어미어마한 명작이다! 감동에 또 감동..이런 인생 명작 이제서야..2021년에야 봤다.."
"584","극장판 귀멸의 칼날: 무한열차편","1","너무 역겹습니다 이런 일뽕에 차서 욱일기 사용하는 작가의 작품을 무비판적으로 수용하는 사람들이 너무 많다니 사람들이 점점 멍청해져 가는 것이 맞는 것 같습니다. 이거 보는 사람들 제발 정신 차리시고 책을 읽으시던지 산책을 하세요 제발 공부도 좀 하시고 운동도 하시는데 제발 일뽕 애니에 빠져서 정신 못 차리지만 마세요 연출 연기 스토리 영상미 OST 다 쓰레기 같습니다"
"585","PMC: 더 벙커","10","분위기와 흐름이 자연스럽고 끝내 아름답고 사랑스러운 영화"
"586","미나리","10","한씬 한씬 궁금해서 계속 보게되는 영화.."
"587","극장판 귀멸의 칼날: 무한열차편","2","아 진짜 개는 건드리지 마라ㅡㅡ"
"588","세자매","7","일반인들이 알 수 없었던 소방관의 새로운 면모를 보여준 영화스토리가 전형적이긴 하나 볼 만은 하다"
"589","그랜드파더","10","It’s not your fault."
"590","미나리","10","잼있네. 시간 가는 줄 모르고 봤어."
"591","미나리","6","불필요한 장면과 어설픈 개연성과대평가 받은 작품"
"592","미나리","1","25분 버텼다 ㅜ.ㅜ 너무 하노 진짜 ㅋㅋㅋ"
"593","미나리","10","이 영화는 그냥 최고다... 몇번을 봐도 안 질리네"
"594","극장판 귀멸의 칼날: 무한열차편","9","가볍게 보려했는데 연출과 코믹 케미 작렬"
"595","PMC: 더 벙커","10","아니 이렇게 명작이 평점이 왜이리 낮음? 개 잼있는데.. 처음에 본것보다 두번째보니 명작이였네.."
"596","미나리","7","인종주의적 설정의 한계."
"597","극장판 귀멸의 칼날: 무한열차편","10","와 이런 영화가 있었어?.. 최근 신하균 배우님 연기에 빠져서 작품 찾다가 보게된영화 이건 장르가 뭐죠?.. SF 라고만 단정 짓기엔 미스터리 스릴러에 고어한 느낌도 있고 사회적 현실도 적절히 잘 반영된 블랙 코미디?.. 러닝 타임동안 이 영화의 온도차가 들쑥날쑥 하지만 전혀 이상하지 않은건 이캐릭터의 이배우들이 였기에 가능했던게 아닐까 정말 지구는 누가 지키죠? 여운이 오래 남아 몇번 더 찾아 보게 될듯 리메이크 희망해봅니다"
"598","세자매","8","스릴있는 영화지만 뻔한 스토리와 결말이 예상되는 내용 나쁜년 연기는 훌륭했다.발연기는 일품ㅋㅋ"
"599","그랜드파더","10","김영광 잘생겼다"
"600","미나리","10","천재는 미친놈인 것 같아요"
"601","미나리","5","가족을 잃은 슬픔의 순간을 잘 전달하고 있는데, 전반적으로 무난하고 특색이 없다는 것이 단점이다."
"602","미나리","10","재밌습니다 작화가 좋아요"
"603","미나리","10","남자가 눈물 흐르게 만들었네요"
"604","극장판 귀멸의 칼날: 무한열차편","10","영화에서 연출된 모든 것이 서로 시너지를 내면서 작품을 완벽하게 만들었다 한가지 아쉬운건 내가 이 영화를 영화관에서 못 본거.."
"605","PMC: 더 벙커","2","기대안하고 봤는데 너무 별로에요. 90년대에 복붙처럼 막 찍어댄 흔한 스릴러느낌. 괜찮은 소재였는데..감독이 못살렸어요. 소재가 너무 아깝습니다."
"606","미나리","1","뜬금 신파야 참겠는데... 1도 없는 개연성... 허술한 액션... 의미없이 감수하는 위험.... 못 봐줄정도다.... 차뒤에 서서 쏴도 되는걸 굳이 길막고 쏘다 피하고... 온갖 복선이 다 너무 튀어서 앞날이 너무 뻔한데 차 액션도 구려... 긴박감도 없고... 염정화 역할도 오바스럽고... 아니 이 배우들 가져다 이렇게 낭비하는게 ㅋㅋㅋㅋ 진짜 그것도 기술이다... 연출력이 진짜 대박임... 어쩜 이리 재미없게 만드는지... 너무 뻔하게 흘러가는데 인물들의 행동이 다 그냥 맹목적이다. 맹목적으로 착하고 나쁘고 선하고 정의감넘치고... 그와중에 반전들마저 어설프고... 액션은 속도감대신 축축쳐진다. 배기음이 강렬하다고 속도감이 붙는게 아님... 중학생 수준의 스토리에... 제일 문제는 감독의 연출... 찍어놓고 아까워서 늘어난 영화시간까지... 뭐 괜찮은게 하나도 없다..."
"607","극장판 귀멸의 칼날: 무한열차편","10","위트가 살아있는 추리영화이며 한사람의 선한마음만으로 감동을 주는 영화"
"608","세자매","10","2008년 개봉 당시 보고싶었던  그리고 청춘일때 봤다면 어떤 감정이 였을까 그리고 나에게 어떠한 영감을 줬을까2021년 지금. Bravo my life후회없이 도전하고 즐기며 성취하여 모든것을 사랑하라.그리고 벤저민처럼 나의 유산 기록은 꼭 남기자기록은 기억을 지배하니까"
"609","그랜드파더","3","어차피 후속편 만들거였으면 세계관과 드라마에 대해 고민해보는게 좋지 않았겠어? 뭐 내용이 읍써도 너무 읍다야!"
"610","미나리","10","뻔한 눈물장전 결말일줄알았는데 그렇지았않아서 좋았다. 엄마의 소중함을 다시한번 느낀영화."
"611","미나리","8","일어날일은 일어난다면 미래의 파괴된 환경은 결국 일어났고 과거에 환경이 망가지던 덜 망가지던 미래의 파괴된 환경은 이미 일어난 일인데 왜 굳이 미래인이 과거에 관여하려한건지 좀 이해가 안되네"
"612","미나리","1","커쇼를 향해 가즈아~~~~!"
"613","미나리","8","기예르모 델 토로의 잔혹동화."
"614","극장판 귀멸의 칼날: 무한열차편","10","두번 봤는데 존잼 ㅠㅠ ㅋㅋㅋ"
"615","PMC: 더 벙커","8","러닝타임 내내 스토리, 영상미, 연기 등등 쩔던데 갑자기 훅 꺼져버리고 끝난 느낌... 근데 속편 제작 계획이었다고? 기다린다.."
"616","미나리","10",""
"617","극장판 귀멸의 칼날: 무한열차편","10","나도 누군가가 내 마음을 분해하고 고쳐줬으면 좋겠네...."
"618","세자매","10","왜 2021년도에 봤을까요.. 단순한 멜로를 넘어선.. 또 보고 또 보고 있어요 ㅎㅎ 물론 영어공부 위해서 보기 시작했지만, 이 영화 스크립트 다 외우기 목표입니댜??"
"619","그랜드파더","10","넷플릭스에서 시리즈를 하루만에 완주하고...다음스토리 너무 궁금해서 극장판 봤습니다. 너무 잼나요ㅠㅠ 정말 십여년만에 보는 일본 애니인데 귀멸의 칼날은 정말 완벽해요. 영화 보고 난 다음 내용도 궁금해서 e북 만화책 구매했어요. 완결이 났다고 하니 기절시켜서 깨워달라고 할 필요없이 안심하고 정주행 가능할거 같아요."
"620","미나리","2","연출...스토리...다별로입니다.진짜 별로다"
"621","미나리","6","전종서 연기보려고 계속봄"
"622","미나리","10",""
"623","미나리","2","돈주고보기 아까웠습니다.cg는 외국 큰자본 영화의 cg에 크게 떨어지지않았습니다. 근데 내용이...."
"624","극장판 귀멸의 칼날: 무한열차편","9","느리지만 강한 메시지연기와 연출 흠잡을데 없어요"
"625","PMC: 더 벙커","10","박해수 너무 안죽는거 빼곤 볼만했음"
"626","미나리","10",""
"627","극장판 귀멸의 칼날: 무한열차편","10","왜 그냥 무덤덤하게본 영화 한편에 눈물이 나는건지  ... 벤자민이라는 단어만 상기시켜도 그냥 가슴이 저릿하다"
"628","세자매","7","너 스스로를 가두지 마. 한번 더 망설이면 끝이다"
"629","그랜드파더","2","여자는 피해자 남자는 가해자 ㅇㅂ하고 자빠졌네 ㅉㅉㅉ"
"630","미나리","10",""
"631","미나리","1","말같지도 않은 설정..."
"632","미나리","1","너무 밋밋하고 잔잔하네요  이런 스토리를 이렇게 교과서처럼 무미건조하게 만드는 것도 능력입니다  감독이나 연기자 모두 아쉬움이 많네요  특히 여주인공의 행동이 전혀 개연성이 없네요  경찰에 신고하지도 않고 남주인공을 왜 그냥 믿어버리는건지  도무지 영화에 몰입이 되지 않음 절제를 너무 하다보니 영화를 절단을 내놨네"
"633","미나리","10","오늘부터 내인생의 인생영화가 늘었다!진짜  사람은 배워야하고 나아가야한다는것도 다시금  뼈저리게 느꼈고!  헝그리정신ㆍ부정으로는 못할것이 없다는것도  이 영화를 보며 느꼈다!요새같은 힘든시기에 정말 내삶을 되돌아보게하는 명작을 보게되어  넘감사하다^^"
"634","극장판 귀멸의 칼날: 무한열차편","5","김희원은연기 참 맛깔나게 한다"
"635","PMC: 더 벙커","4","전형적인 스포츠 영화를 보여주는데, 캐릭터들이 생각만큼 인상적이진 않아서 몰입하기가 쉽진 않다."
"636","미나리","10","스릴러 끝판왕 연기 연출 모두 최고"
"637","극장판 귀멸의 칼날: 무한열차편","10","이제 더 이상 이런 영화는 중국에서 기대할 수 없다."
"638","세자매","10","아주 많은 생각을 하게 해주는 영화. cg나 장소이동에 필요없이 배우 캐스팅에 제작비를 몰빵한 영화.소소한 웃음거리가 이어지고 철학적 사색이 포함된 영화"
"639","그랜드파더","7","역시 분수대 키스신은 역대급이다. 단지, 그것뿐이었다."
"640","미나리","10",""
"641","미나리","8","2d연출은 어색하지 않게 잘나타냈지만 스토리가 지루한부분이 없지않아 있습니다"
"642","미나리","8","간만에 좋은 영화 일것 같았는데.... 흐름이 너무 끊어지네요. 영상은 너무 아름 다운데~스토리가 조금더 깊었으면 너무 좋았겠어요. 아쉽다. 너무 아쉽다.이런 영화 좀더 나왔으면 좋겠네요~^^"
"643","미나리","10","2가 나오기를 기다립니다 ㅜ ㅜ"
"644","극장판 귀멸의 칼날: 무한열차편","9","갓버트드니로.. 내 마음이 다 편해지네"
"645","PMC: 더 벙커","8","권총 2정 만으로 선사하는 예술의 극한"
"646","미나리","1","보다가 잠들었음 개노잼"
"647","극장판 귀멸의 칼날: 무한열차편","10","진짜 한 두세번 본거 처음이에요 이 영화에 대해 아무것도 모르는 친구랑 봤는데 친구도 재밌게 보고 눈물도 흘렸을 정도로 정말 감동적이고 재미있는 영화에요 특히 액션이 뛰어납니다.... 애니메이터 분들 손목이 걱정 될 정도입니다..."
"648","세자매","5","성장형 먼치킨 드라마 한편 본듯"
"649","그랜드파더","10","영화 채널에서 처음부터 하길래 틀어놓고 뭐 먹으면서 봤는데 재밌어서 다 먹고부터는 몰입해서 봤네요. 쟁쟁한 배우들에 스토리가 조금 뻔하다면 뻔할 수 있지만 세조 실록에 나온 글을 토대로 이런 영화를 만들다니 신박하다는 생각이 들었습니다. 요즘 한국사 공부하는데 좀 지루하다가도 이런 역사 관련 재밌는 영화보면 공부할 맛도 나고 어디까지가 사실일까 생각도 해볼수 있어서 좋았습니다. 역사적 내용에 웃음코드 약간의 슬픈코드 다 있어서 재밌게 본 영화입니다!"
"650","미나리","6","무능한 변호사..뻔한 반전?"
"651","미나리","10","Fred(고양이)하나의 눈을 가진 하나밖에 없는 친구. ♡ 삶 속에서 진짜를 놓치지 않길 바래요.♡영화가 끝나니 감명이 시작되네요.알고 있다고 생각한 것들은 실제론 알고 있었다고 믿고 싶었던 것들일까? 내가 안된다고 생각한 것들은실제론 타인을 위한 것일까 나를 위한 것일까? 나에 대한 믿음이 타인에게 신뢰로 허나 부족하지 않는 사람이 어디 있을까? 쓰다보니깐 무슨 말인지 모르겠다.완전한 문장을 써야 좋은 것일까?  Be happy every moment plz :D"
"652","미나리","2","이렇게 재미없는영화가 있었나시간아까움"
"653","미나리","10",""
"654","극장판 귀멸의 칼날: 무한열차편","10",""
"655","PMC: 더 벙커","9","원작 안보고 봐도 재미 있어요 어른들이 봐도 좋은 영화 같아요"
